{
  "$schema": "http://json-schema.org/draft-07/schema#",
  "$id": "stats.json",
  "title": "PaperStats",
  "description": "Structured numerical record for a single research paper. Written by research-paper-summarizer alongside the markdown summary; consumed by research-accuracy-verifier at Stage 6 (numerical sanity) via cat substitution. Validated by scripts/validate_stats.py against this schema (Stage 1) plus rule predicates Q5/R5 from skills/shared/references/prose_standards_thresholds.yaml (Stage 2).",
  "type": "object",
  "required": [
    "paper_id",
    "stats",
    "preserved_numerics_count",
    "rule_compliance"
  ],
  "additionalProperties": false,
  "properties": {
    "paper_id": {
      "type": "string",
      "minLength": 1,
      "description": "Stable identifier for this paper. Prefer DOI (with or without https://doi.org/ prefix); fall back to PMID, PMCID, or a kebab-case slug derived from first-author + year + short-title when no persistent identifier is available. MUST match source_meta.json paper_id."
    },
    "source_path": {
      "type": ["string", "null"],
      "description": "Absolute or repo-relative path to the resolved full-text source (PDF, markitdown output, or PMC XML). Null when only a DOI/PMID was provided and full-text retrieval was deferred."
    },
    "extracted_at": {
      "type": "string",
      "format": "date-time",
      "description": "ISO-8601 timestamp of stats extraction. Lets the verifier detect stale stats files when the source paper has been re-summarized."
    },
    "stats": {
      "type": "array",
      "description": "Every numeric value preserved from the source paper. Q5 (numerical_consistency) requires that each entry's value/unit pair appears verbatim in the source.",
      "items": {
        "type": "object",
        "required": [
          "claim_id",
          "value",
          "unit",
          "context",
          "source_location",
          "verbatim"
        ],
        "additionalProperties": false,
        "properties": {
          "claim_id": {
            "type": "string",
            "pattern": "^C-[0-9]{2,4}$",
            "description": "Stable per-paper claim identifier. Format C-NN (zero-padded 2-4 digits). Stable across re-runs of the same paper so that downstream verifier evidence pinning survives re-summarization."
          },
          "value": {
            "type": ["number", "string"],
            "description": "The numeric value as it appears in the source. Strings allowed for inequality forms (e.g., '<0.001', '>=120'), exponential notation passed through verbatim, or composite ratios. Plain numerals SHOULD be JSON numbers."
          },
          "unit": {
            "type": ["string", "null"],
            "description": "Unit string preserved from the source verbatim ('mg/kg', '%', 'ng/mL', 'µm', 'p-value', 'count', 'fold'). Null only when the value is intrinsically unitless (e.g., a count of patients reported without 'patients' or 'n =' label — rare)."
          },
          "context": {
            "type": "string",
            "minLength": 1,
            "maxLength": 280,
            "description": "Short surrounding context (≤280 chars) that disambiguates the value. Quotes the source clause minimally; not a full sentence dump."
          },
          "source_location": {
            "type": "string",
            "minLength": 1,
            "description": "Where in the source the value appears: 'Abstract', 'Results §3.2', 'Table 1', 'Figure 4 legend', 'Methods §2.1', etc. Used by the verifier when emitting evidence references."
          },
          "verbatim": {
            "type": "boolean",
            "description": "Q5 self-attestation: true iff value+unit appear in the source exactly as recorded (no rounding, no unit conversion). MUST be true for compliant stats; false entries are tolerated only when explicit conversion notes are provided in `notes`."
          },
          "stat_type": {
            "type": ["string", "null"],
            "enum": [
              "p_value",
              "confidence_interval",
              "sample_size",
              "percentage",
              "mean",
              "median",
              "standard_deviation",
              "standard_error",
              "ratio",
              "fold_change",
              "correlation",
              "effect_size",
              "count",
              "rate",
              "concentration",
              "duration",
              "other",
              null
            ],
            "description": "Optional categorical tag. Mirrors utils.schemas.StatisticType. `null` is listed in the enum (alongside the type union) because Draft-07 applies `enum` to all instances regardless of declared type — omitting null from the enum would forbid null even when the type union permits it. Lets validators apply type-specific predicates (e.g., p-values must obey Q2 reporting rules)."
          },
          "notes": {
            "type": ["string", "null"],
            "maxLength": 280,
            "description": "Optional free-text rationale, used when verbatim=false to explain the conversion or normalization performed. Keep under 280 chars."
          }
        }
      }
    },
    "preserved_numerics_count": {
      "type": "integer",
      "minimum": 0,
      "description": "Equals len(stats). Cross-check field — validate_stats.py errors if it disagrees with the array length."
    },
    "rule_compliance": {
      "type": "object",
      "required": ["Q5", "R5"],
      "additionalProperties": false,
      "properties": {
        "Q5": {
          "type": "string",
          "enum": ["pass", "fail", "unknown"],
          "description": "Q5 (numerical_consistency, CRITICAL): every stats[] entry has verbatim=true and a non-empty source_location. 'unknown' is reserved for partial extractions where the rule could not be evaluated."
        },
        "R5": {
          "type": "string",
          "enum": ["pass", "fail", "unknown"],
          "description": "R5 (numerical_consistency_full, CRITICAL): no two stats[] entries share a claim_id with conflicting value/unit pairs (cross-section reconciliation). 'unknown' is reserved for partial extractions."
        }
      }
    },
    "extraction_meta": {
      "type": ["object", "null"],
      "description": "Optional provenance block. Recommended in fork mode so the verifier can inspect extraction conditions without reading the full markdown summary.",
      "additionalProperties": true,
      "properties": {
        "extractor_version": {
          "type": "string",
          "description": "Semver of the extract_statistics.py script that produced this file."
        },
        "article_type": {
          "type": "string",
          "enum": ["general", "review", "compbio", "cellmolbio"]
        },
        "page_count": {
          "type": ["integer", "null"],
          "minimum": 1
        },
        "processing_mode": {
          "type": ["string", "null"],
          "enum": ["standard", "chunked", null]
        }
      }
    }
  }
}
